Number,Title,Data
" Commonwealth Act No. 366, August 23, 1938 ",AN ACT TO AMEND PARAGRAPH (E) OF SECTION TWENTY-FIVE HUNDRED SIXTY OF THE ADMINISTRATIVE CODE.(awÞhi(,"[ Commonwealth Act No. 366, August 23, 1938 ]
AN ACT TO AMEND PARAGRAPH (E) OF SECTION TWENTY-FIVE HUNDRED SIXTY OF THE ADMINISTRATIVE CODE.(awÞhi(
Be it enacted by the National Assembly of the Philippines:
Section 1. Paragraph (e) of section twenty-five hundred sixty of the Administrative Code, is amended so as to read as follows:
""(e) He shall have charge of the prosecution of all crimes, misdemeanors, and violations of city ordinances in the Court of First Instance and in the municipal court of the city.""
Section 2. This Act shall take effect upon its approval.
Approved, August 23, 1938.

The Lawphil Project - Arellano Law Foundation"
