Number,Title,Data
BATAS PAMBANSA Blg. 247,"An Act Establishing a Municipal Hospital with Ten-Bed Capacity and Secondary Level Capability in the Municipality of Sta. Maria, Province of Isabela, to be Known as the Elvin Masigan Municipal Hospital and Authorizing the Appropriation of Funds Therefor","BATAS PAMBANSA Blg. 247
An Act Establishing a Municipal Hospital with Ten-Bed Capacity and Secondary Level Capability in the Municipality of Sta. Maria, Province of Isabela, to be Known as the Elvin Masigan Municipal Hospital and Authorizing the Appropriation of Funds Therefor
Section 1. There shall be established, under the direct supervision of the Office of the Minister (Ministry of Health), a municipal hospital in the Municipality of Sta. Maria, Province of Isabela, to be known as the Elvin Masigan Municipal Hospital.
Section 2. The amount needed for the operation of the hospital shall be determined in accordance with Section 40 of Presidential Decree No. 1177 and charged to the appropriations authorized by Batas Pambansa Blg. 131 for the Ministry of Health intended for new hospitals. Thereafter, such sum as may be necessary for its operation and maintenance shall be included in the annual General Appropriations Act. The Minister of Health shall determine the manner by which said hospital shall be made operational.
Approved: November 11, 1982

The Lawphil Project - Arellano Law Foundation"
