Number,Title,Data
" Act No. 1987, April 19, 1910 ","AN ACT APPROPRIATING FUNDS FOR SUNDRY EXPENSES OF THE UNIVERSITY OF THE PHILIPPINES DURING THE FISCAL YEAR ENDING JUNE THIRTIETH, NINETEEN HUNDRED AND ELEVEN, AND FOR OTHER PURPOSES.","[ Act No. 1987, April 19, 1910 ]
AN ACT APPROPRIATING FUNDS FOR SUNDRY EXPENSES OF THE UNIVERSITY OF THE PHILIPPINES DURING THE FISCAL YEAR ENDING JUNE THIRTIETH, NINETEEN HUNDRED AND ELEVEN, AND FOR OTHER PURPOSES.
By authority of the United States, be it enacted by the Philippine Legislature, that:
Section 1. The following sums, or so much thereof as may be respectively necessary, are hereby appropriated, out of any funds in the Insular Treasury not otherwise appropriated, for the University of the Philippines, to be expended by the Board of Regents of said University, for the ends specified by law, in accordance with section six, letter (a), of Act Numbered Eighteen hundred and seventy, during the fiscal year ending June thirtieth, nineteen hundred and eleven:
For the office of the Board of Regents, one thousand five hundred pesos; for the College of Agriculture, sixty-eight thousand eight hundred pesos; for the School of Fine Arts, twenty-eight thousand and ten pesos; for the College of Veterinary Science, eighteen thousand one hundred pesos; for the College of Philosophy, Science, and Letters, sixty-seven thousand six hundred pesos; for the College of Civil Engineering, six thousand pesos; in all, one hundred and ninety thousand and. ten pesos: Provided, That the Board of Regents may, in its discretion, transfer the whole or an}' part of the appropriation for any college, school, or office of the University of the Philippines to any other college, school, or office of the University of the Philippines and expend the same in the manner which the said Board shall deem most necessary and expedient: And provided further, That the Board of Regents is hereby authorized to appoint employees of the Departments and Bureaus of the Government to positions in the University of the Philippines at such compensation as may be fixed by said Board of Regents, which compensation shall be paid to such employees from the appropriation for the University of the Philippines, Act Numbered One hundred and forty-eight to the contrary notwithstanding.
Section 2.1aшphi1 The public good requiring the speedy enactment of this bill, the same shall take effect on its passage, in accordance with section one of Act Numbered Nineteen hundred and forty-five of the Philippine Legislature.
Enacted, April 19,1910.

The Lawphil Project - Arellano Law Foundation"
