Number,Title,Data
" Act No. 612, February 03, 1903 ","AN ACT AMENDING ACT NUMBERED ONE HUNDRED AND EIGHTY-THREE, ENTITLED ""AN ACT TO INCORPORATE THE CITY OF MANILA,"" AS AMENDED BY ACTS NUMBERED TWO HUNDRED AND SIXTY-SEVEN AND FOUR HUNDRED AND SEVENTY-SIX, AND AMENDING ACT NUMBERED ONE HUNDRED AND EIGHTY-FIVE, ENTITLED ""AN ACT REGULATING THE SALARIES OF OFFICERS AND EMPLOYEES IN THE MUNICIPAL SERVICE OF MANILA,"" AS AMENDED BY SAID ACT NUMBERED FOUR HUNDRED AND SEVENTY-SIX.","[ Act No. 612, February 03, 1903 ]
AN ACT AMENDING ACT NUMBERED ONE HUNDRED AND EIGHTY-THREE, ENTITLED ""AN ACT TO INCORPORATE THE CITY OF MANILA,"" AS AMENDED BY ACTS NUMBERED TWO HUNDRED AND SIXTY-SEVEN AND FOUR HUNDRED AND SEVENTY-SIX, AND AMENDING ACT NUMBERED ONE HUNDRED AND EIGHTY-FIVE, ENTITLED ""AN ACT REGULATING THE SALARIES OF OFFICERS AND EMPLOYEES IN THE MUNICIPAL SERVICE OF MANILA,"" AS AMENDED BY SAID ACT NUMBERED FOUR HUNDRED AND SEVENTY-SIX.
By authority of the United States, be it enacted by the Philippine Commission, that:
Section 1. Section thirty-nine of Act Numbered One hundred and eighty-three, entitled ""An Act to incorporate the city of Manila,"" as amended by Act Numbered Four hundred and seventy-six, is hereby amended so as to provide that there shall be three Assistant Prosecuting Attorneys who shall assist the Prosecuting Attorney as he shall direct, instead of four such assistants, as provided in said Act Numbered Four hundred and seventy-six.
Section 2. Section forty of Act Numbered One hundred and eighty-three, entitled ""An Act to incorporate the city of Manila,"" enacted July thirty-first, nineteen hundred and one, is hereby amended by abolishing the two municipal courts therein provided for and substituting therefor one municipal court with territorial jurisdiction embracing the entire police jurisdiction of the city, and with exactly the same powers and duties in the exercise of its jurisdiction over the whole territory within the police jurisdiction of the city as the two existing municipal courts have heretofore exercised within the limits of their respective territorial jurisdictions. All the provisions with respect to the processes, procedure, rights of parties, and jurisdiction, except territorial, of section forty shall be and remain in force, so far as the same are or can be made applicable to one court instead of two, with respect to the new court, except as hereinafter specifically amended or modified. The duties and powers which appertain to the executive officers of the city or the Insular Government, with respect to the two courts created by section forty, shall hereafter appertain to them in respect to the single court now substitute for the two existing courts.
The Civil Governor, by and with the consent of the Commission, shall appoint a judge and clerk for such new municipal court, and a vacancy occurring in the clerkship, after the first appointment, shall be filled under the provisions and restrictions of the Civil Service Act. A temporary vacancy in the office of the judge, occasioned by sickness or absence, shall be filled by appointment by the Civil Governor. It shall not be within the power of a defendant in the municipal court in a case triable in that court to demand a preliminary examination, except a summary one, the extent of which shall be within the discretion of the court, to enable the court to fix the bail, in any case where the prosecution announces itself ready and is ready for trial within three days, not including Sundays, after the request for a priliminary examination is presented to the court. In cases triable only in the Court of First Instance in the city of Manila, the defendant shall have a speedy trial, but shall not be entitled as of right to a preliminary examination in any case where the prosecuting attorney, after a due investigation of the facts, under section thirty-nine of Act of which this is an amendment, shall have presented an information against him in proper form: Provided, however, That the Court of First Instance may make such summary investigation into the case as it may deem necessary to enable it to fix bail or to determine whether the offense is bailable.
Section 3. All cases now pending in the present municipal courts of Manila shall be transferred to the municipal court by this Act established, and they shall proceed to judgment exactly as if they had been begun in the municipal court by this Act established, and with the same effect as though they had been prosecuted to judgment in the present municipal courts.
Section 4. Section forty-two of Act Numbered One hundred and eighty-three, entitled ""An Act to incorporate the city of Manila,"" as amended so that said section shall read as follows:
""Section 42. Appeals to Courts of First Instance.-An appeal shall lie to the Court of First Instance next to be held within the city, in all cases of acquittal, or where fine or imprisonment, or both, is imposed by the municipal court. To perfect an appeal, the party desiring to appeal shall, before six o'clock postmeridian of the day after the rendition and entry of the judgment by the municipal court, file with the clerk of the court a written statement that he appeals to the Court of First Instance. The filing of such statement shall perfect the appeal. The judge of the court from whose decision appeal is taken shall, within five days after the appeal is taken, transmit to the clerk of the Court of First Instance a certified copy of the record of proceedings and all the original papers and process in the case, and the clerk of the Court of First Instance shall docket the appeal in that court. A perfected appeal shall operate to vacate the judgment of the municipal court, and the action, when duly entered in the Court of First Instance, shall stand for trial de novo upon its merits in accordance with the regular procedure in that court, as though the same had never been tried and had been originally there commenced. Pending an appeal, the defendant shall remain in custody unless released in the discretion of the judge of the municipal court or of the judge of the Court of First Instance upon sufficient bail, in accordance with the rules and regulations now or hereafter in force, to await the judgment of the appellate court.""
This section shall only apply to prosecutions for offenses committed after the passage hereof. As to offenses committed before the passage hereof, the provisions of law for appeals from the existing municipal courts shall be in force in so far as they may be applicable to appeals from the municipal court by this Act created.
Section 5. In the municipal court of Manila judicial notice shall be taken of all municipal ordinance passed by the Municipal Board for the city of Manila, and no proof of the same shall be required; and in cases of appeal form judgments of the municipal court int he Court of Firs Instance, the same rule of evidence shall obtain.1aшphi1
Section 6. Section twelve of Act Numbered One hundred and eighty-five, entitled ""An Act regulating the salaries of officers and employees in the municipal service of Manila,"" as amended by Act Numbered Four hundred and seventy-six, is hereby repealed, and the following is substituted therefor:
""Section 12. The City Attorney shall receive an annual compensation of three thousand five hundred dollars; the Assistant City Attorney shall receive an annual compensation of two thousand five hundred dollars. the may be employed in the office of the City Attorney: Two clerks of class six; one translator of class seven; one typewriter of class eight; one typewriter of class nine; two clerks of class nine; one clerk of Class C; one messenger at the rate of one hundred and twenty dollars per annum.
""The Prosecuting Attorney shall receive an annual compensation of four thousand five hundred dollars; the First Assistant Prosecuting Attorney shall receive an annual compensation of two thousand five hundred dollars; the Third Assistant Prosecuting Attorney shall receive an annual compensation of two thousand dollars.
""There may be employed in the office of the Prosecuting Attorney: One stenographer of class eight; one clerk of class eight; one clerks of class nine; one translator of class nine; one interpreter of Class A; and one messenger at the rate of one hundred and twenty dollars per annum.
""The judge of the municipal court of Manila shall receive an annual compensation of three thousand five hundred dollars, and the clerk of the court shall receive an annual compensation of one thousand six hundred dollars. There may be employed int eh office of the clerk of the court: One deputy clerk at a compensation of one thousand dollars per annum; one deputy clerk at an annual compensation of six hundred dollars; one interpreter at a compensation of one thousand six hundred dollars per annum.""
Section 7. The parts of Act Numbered one hundred and eight-three, entitled ""An Act to incorporate the city of Manila,"" as amended by Acts Numbered Two hundred and sixty-seven and Four hundred and seventy-six, and Act Numbered One hundred and eighty-five, entitled ""An At regulating the salaries of officers and employees in the municipal service of Manila,"" as amended by Act Numbered Four as amended by Act Numbered Four hundred and seventy-six, which are inconsistent with the present Act, to the extent to which they are inconsistent, are hereby repealed.
Section 8. The public good requiring the speedy enactment of this bill, the passage of the same is hereby expedited in accordance with section two of ""An Act prescribing the order of procedure by the Commission in the enactment of laws,"" passed September twenty-sixth, nineteen hundred.
Section 9. This act shall take effect on the fifteenth day of February, nineteen hundred and three.
Enacted, February 3, 1903.

The Lawphil Project - Arellano Law Foundation"
