Number,Title,Data
" Act No. 3472, December 07, 1928 ","AN ACT AMENDING SECTION TWELVE HUNDRED AND EIGHTEEN OF ACT NUMBERED TWENTY-SEVEN HUNDRED AND ELEVEN, KNOWN AS THE ADMINISTRATIVE CODE, RELATIVE TO VESSELS ELIGIBLE FOR BAY AND RIVER LICENSE.","[ Act No. 3472, December 07, 1928 ]
AN ACT AMENDING SECTION TWELVE HUNDRED AND EIGHTEEN OF ACT NUMBERED TWENTY-SEVEN HUNDRED AND ELEVEN, KNOWN AS THE ADMINISTRATIVE CODE, RELATIVE TO VESSELS ELIGIBLE FOR BAY AND RIVER LICENSE.
Be it enacted by the Senate and House of Representatives of the Philippines in Legislature assembled and by the authority of the same:
Section 1. Section twelve hundred and eighteen of Act Numbered Twenty-seven hundred and eleven, known as the Administrative Code, is hereby amended to read as follows:
""Section 1218. Vessels eligible for bay and river license.- To be eligible for the bay and river license, a vessel must be built in the Philippine Islands or in the United States, and the ownership of such vessel must be vested in some one or more of the following classes of persons: (a) Citizens of the United States; (b) Citizens or residents of the Philippine Islands; (c) Domestic corporations or companies; (d) Foreign corporations or companies lawfully engaged in business in the Philippine Islands.
Vessels actually engaged in the bay and river business in any port of the Philippine Islands on the twenty-ninth day of April nineteen hundred and eight, may be licensed in the future for the same business, regardless of ownership or place of construction, subject in other respect to the same regulations and conditions as other vessels: Provided, however, That vessels of one hundred fifty gross tons or over may be licensed regardless of the place of their construction.""
Section 2. This Act shall take effect upon its approval.1aшphi1
Approved, December 7, 1928.

The Lawphil Project - Arellano Law Foundation"
