Number,Title,Data
" Act No. 1524, August 09, 1906 ",AN ACT PROVIDING FOR THE ENFORCEMENT OF CONDITIONS MADE BY THE GOVERNOR-GENERAL IN THE EXERCISE OF HIS DISCRETION IN GRANTING CONDITIONAL PARDONS.,"[ Act No. 1524, August 09, 1906 ]
AN ACT PROVIDING FOR THE ENFORCEMENT OF CONDITIONS MADE BY THE GOVERNOR-GENERAL IN THE EXERCISE OF HIS DISCRETION IN GRANTING CONDITIONAL PARDONS.
By authority of the United States, be it enacted by the Philippine Commission, that:
Section 1. Whenever the Governor-General shall, in his discretion, grant a conditional pardon to any person convicted of crime under the laws of the Philippine Islands, the conditions shall be fully set forth in the pardon and a copy of the conditional pardon shall in each case be delivered to the person so pardoned, and also a copy thereof filed in the office of the clerk of the Court of First Instance of the province or judicial district in which such person was tried and convicted.
Section 2. It shall be the duty of the clerk of the Court of First Instance to send a certified copy of each conditional pardon received by him, as provided in section one, to the provincial governor and to the senior inspector of Constabulary in the province, and in the . city of Manila the clerk of the Court of First Instance shall send such certified copies to the chief of police of said city and to the Director of Constabulary.
Section 3. Whenever the provincial fiscal, or the prosecuting attorney of the city of Manila, as the case may be, shall ascertain that any of the conditions of a conditional pardon, heretofore or hereafter granted, has been violated by the person so conditionally pardoned, he shall apply to the Court of First Instance for an order of arrest against the person so conditionally pardoned to have him brought before the court.  The Court of First; Instance shall issue the order of arrest and proceed with the investigation of the facts, in the presence of the accused and the proper prosecuting official.
Section 4 If the court shall find from said investigation that one or more of the conditions of such pardon, heretofore or hereafter granted, has been violated by the person so pardoned, the court shall order the recommitment and confinement of such person in the proper prison for the unexpired portion of his original sentence. Such order of the court shall be sufficient authority to the custodian of any public prison designated therein to receive and safely keep the body of the person so conditionally pardoned during the unexpired portion of his original sentence.
Section 5. The public good requiring the speedy enactment of this bill, the passage of the same is hereby expedited in accordance with section two of ""An Act prescribing the order of procedure by the '  Commission in the enactment of laws,"" passed September twenty-sixth, nineteen hundred.
Section 6. This Act shall take effect on its passage.
Enacted, August 9, 1906.

The Lawphil Project - Arellano Law Foundation"
