Number,Title,Data
" Act No. 714, April 01, 1903 ",AN ACT APPROPRIATING THE SUM OF FIVE THOUSAND DOLLARS TO BE EXPENDED IN THE DISCRETION OF THE COLLECTOR OF CUSTOMS FOR THE PHILIPPINE ARCHIPELAGO.,"[ Act No. 714, April 01, 1903 ]
AN ACT APPROPRIATING THE SUM OF FIVE THOUSAND DOLLARS TO BE EXPENDED IN THE DISCRETION OF THE COLLECTOR OF CUSTOMS FOR THE PHILIPPINE ARCHIPELAGO.
By authority of the United States, be it enacted by the Philippine Commission, that:
Section 1. There is hereby appropriated, out of any money in the Insular Treasury not otherwise appropriated, the sum of five thousand dollars, United States currency, for expenditure in the discretion of the Collector of Customs for the Philippine Archipelago during the fiscal year ending June thirtieth, nineteen hundred and three.1aшphi1
Section 2. The public good requiring the speedy enactment of this bill, the passage of the same is hereby expedited in accordance with section two of ""An Act prescribing the order of procedure by the Commission in the enactment of laws,"" passed September twenty-sixth, nineteen hundred.
Section 3. This Act shall take effect on its passage.
Enacted, April 1, 1903.

The Lawphil Project - Arellano Law Foundation"
