Number,Title,Data
" Act No. 3543, November 22, 1929 ","AN ACT TO AMEND SECTION TWENTY-TWO HUNDRED AND SIXTY-THREE OF ACT NUMBERED TWENTY-SEVEN HUNDRED AND ELEVEN, KNOWN AS THE ADMINISTRATIVE CODE.","[ Act No. 3543, November 22, 1929 ]
AN ACT TO AMEND SECTION TWENTY-TWO HUNDRED AND SIXTY-THREE OF ACT NUMBERED TWENTY-SEVEN HUNDRED AND ELEVEN, KNOWN AS THE ADMINISTRATIVE CODE.
Be it enacted by the Senate and House of Representatives of the Philippines in Legislature assembled, and by the authority of the same:
Section 1. Section twenty-two hundred and sixty-three of Act Numbered Twenty-seven hundred and eleven, known as the Administrative Code, is hereby amended so as to read as follows:
""Section 2263. Expense of equipment.-Each municipality shall, at its own expense, provide all necessary police equipment, including arms, uniforms, and insignia, and may also provide the arm, uniform, and insignia of the chief of police, in conformity with the specifications of the Chief of Constabulary.""
Section 2. This Act shall take effect upon its approval.1aшphi1
Approved, November 22, 1929.

The Lawphil Project - Arellano Law Foundation"
