Number,Title,Data
" Act No. 1085, March 10, 1904 ","AN ACT PROVIDING FOR THE LOAN OF FOUR THOUSAND FIVE HUNDRED PESOS, PHILIPPINE CURRENCY, TO THE PROVINCE OF BATANGAS, AND AUTHORIZING THE PROVINCIAL BOARD OF SAID PROVINCE TO RELOAN THAT SUM TO SUCH MUNICIPALITIES IN THE PROVINCE AS TO THE PROVINCIAL BOARD MAY SEEM PROPER, TO BE USED IN THE PAYMENT OF SALARIES OF TEACHERS EMPLOYED IN THE BARRIO PUBLIC SCHOOLS OF SUCH MUNICIPALITIES, AND FOR NO OTHER PURPOSE.","[ Act No. 1085, March 10, 1904 ]
AN ACT PROVIDING FOR THE LOAN OF FOUR THOUSAND FIVE HUNDRED PESOS, PHILIPPINE CURRENCY, TO THE PROVINCE OF BATANGAS, AND AUTHORIZING THE PROVINCIAL BOARD OF SAID PROVINCE TO RELOAN THAT SUM TO SUCH MUNICIPALITIES IN THE PROVINCE AS TO THE PROVINCIAL BOARD MAY SEEM PROPER, TO BE USED IN THE PAYMENT OF SALARIES OF TEACHERS EMPLOYED IN THE BARRIO PUBLIC SCHOOLS OF SUCH MUNICIPALITIES, AND FOR NO OTHER PURPOSE.
By authority of the United States, be it enacted by the Philippine Commission, that:
Section 1. There is hereby appropriated, out of any funds in the Insular Treasury not otherwise appropriated, the sum of four thousand five hundred pesos. Philippine currency, to be loaned to the Province of Batangas.
Section 2. The money appropriated in section one of this Act shall be paid by the Insular Treasurer to the treasurer of the Province of Batangas on the presentation to the Insular Treasurer of a certified copy of a resolution of the provincial board of Batangas accepting such loan and agreeing to repay the same, without interest, as follows: Two thousand five hundred pesos, Philippine currency, within two years from the date of the acceptance of the loan, and one thousand pesos, Philippine currency, each year thereafter until the full amount of the loan has been repaid to the Insular Treasury.1aшphi1
Section 3. The provincial board of Batangas is hereby authorized to reloan the money thus made available to such municipalities in the province as to it may seem proper, to be used by such municipalities in the payment of teachers employed in their barrio public schools, and for no other purpose, and such loans shall be repaid by the municipalities to the province, without interest, within such time as may be fixed by the provincial board.
Section 4. The public good requiring the speedy enactment of this bill, the passage of the same is hereby expedited in accordance with section two of ""An Act prescribing the order of procedure by the Commission in the enactment of laws,"" passed September twenty-sixth, nineteen hundred.
Section 5. This Act shall take effect on its passage.
Enacted, March 10, 1904.

The Lawphil Project - Arellano Law Foundation"
