Number,Title,Data
" Act No. 866, September 03, 1903 ","AN ACT TO AMEND ACT NUMBERED THREE HUNDRED AND FIFTEEN, CREATING A BUREAU OF THE COLD STORAGE AND ICE PLANT, IN SO FAR AS IT RELATES TO THE DUTIES OF THE CASHIER OF SAID PLANT.","[ Act No. 866, September 03, 1903 ]
AN ACT TO AMEND ACT NUMBERED THREE HUNDRED AND FIFTEEN, CREATING A BUREAU OF THE COLD STORAGE AND ICE PLANT, IN SO FAR AS IT RELATES TO THE DUTIES OF THE CASHIER OF SAID PLANT.
By authority of the United States, be it enacted by the Philippine Commission, that:
Section 1. Section five of Act Numbered Three hundred and fifteen, creating a Bureau of the Cold Storage and Ice Plant, is hereby amended to read as follows:
""Section 5. The cashier shall receive, and is authorized to receipt for all moneys collected for cold storage, ice, distilled water, or other products of the plant, and shall properly account to the Insular Auditor for all such moneys, as well as for the property, blanks, and so forth, which come into his hands as cashier. He shall deposit daily, as far as practicable, the previous day's collections with the Treasurer of the Philippine Islands, to the credit of the Insular Cold Storage and Ice Plant.1aшphi1 When a holiday occurs and it is impossible to deposit the previous day's collections they shall be deposited on the morning of the first business day thereafter.""
Section 2. The public good requiring the speedy enactment of this bill, the passage of the same is hereby expedited in accordance with section two of ""An Act prescribing the order of procedure by the Commission in the enactment of laws,"" passed September twenty-sixth, nineteen hundred.
Section 3. This Act shall take effect on its passage.
Enacted, September 3, 1903.

The Lawphil Project - Arellano Law Foundation"
