Number,Title,Data
" Act No. 1743, October 04, 1907 ",AN ACT TO PROVIDE THAT THE ANNUAL TAX ON THE ASSESSED VALUE OF REAL ESTATE IN THE CITY OF MANILA FOR THE YEAR NINETEEN HUNDRED AND EIGHT SHALL BE ONE AND ONE-HALF PER CENTUM THEREOF.,"[ Act No. 1743, October 04, 1907 ]
AN ACT TO PROVIDE THAT THE ANNUAL TAX ON THE ASSESSED VALUE OF REAL ESTATE IN THE CITY OF MANILA FOR THE YEAR NINETEEN HUNDRED AND EIGHT SHALL BE ONE AND ONE-HALF PER CENTUM THEREOF.
By authority of the United Slates, be it enacted by the Philippine Commission, that:
Section 1. The annual tax on the assessed value of all real estate in the city of Manila subject to taxation shall be for the year nineteen hundred and eight one and one-half per centum thereof instead of two per centum thereof, anything contained in section forty-seven of Act Numbered One hundred and eighty three, as amended, to the contrary notwithstanding: Provided, however, That one per centum of the assessed value of all such real estate shall be payable on or before the first day of July, nineteen hundred and eight, and the remaining one-half of one per centum shall be payable on or before the thirty-first clay of December, nineteen hundred and eight.ℒαwρhi৷
Section 2. The public good requiring the speedy enactment of this bill, the passage of the same is hereby expedited in accordance with section two of ""An Act prescribing the order of procedure by the Commission in the enactment of laws,"" passed September twenty-sixth, nineteen hundred.
Section 3. This Act shall take effect on its passage.
Enacted, October 4, 1907.

The Lawphil Project - Arellano Law Foundation"
